,program-id,program name,program description,dominant gender immatriculation,cleaned wordlists,brysbaert score
3,103,m-diversity-studies-social-sciences,"The programme

Students are encouraged to develop awareness towards their own situatedness and approach to diversity. They also learn to design and implement diversity trainings.

Graduates are qualified to independently acquire, systematize and develop professional knowledge and can make it accessible to different publics; to work independently according to scientific principles; to reflect and evaluate social and political events pertaining to diversity and processes of diversification, both theoretically and empirically, in a scientifically sound way; and to convey the general relevance of social (processes of) differentiation to laypersons.

The courses are taught in German language. A sufficient German language proficiency is required latest by matriculation. A matriculation without a proof of language proficiency is not possible.
Career prospects

The knowledge and competences taught in this Master's programme qualify graduates for positions in various fields in public and private institutions. Possible career paths include working as diversity or equal opportunities officers and consultancy, especially in the occupational fields of social integration, personnel and services management, intercultural opening and organizational development. Potential employers include businesses, university and science management, NGOs, political parties, social and educational establishments and international organizations. This Master's degree programme also provides students with the competencies required to pursue a PhD.",f,"['The', 'programme', 'Students', 'are', 'encouraged', 'to', 'develop', 'awareness', 'towards', 'their', 'own', 'situatedness', 'and', 'approach', 'to', 'diversity', 'They', 'also', 'learn', 'to', 'design', 'and', 'implement', 'diversity', 'trainings', 'Graduates', 'are', 'qualified', 'to', 'independently', 'acquire', 'systematize', 'and', 'develop', 'professional', 'knowledge', 'and', 'can', 'make', 'it', 'accessible', 'to', 'different', 'publics', 'to', 'work', 'independently', 'according', 'to', 'scientific', 'principles', 'to', 'reflect', 'and', 'evaluate', 'social', 'and', 'political', 'events', 'pertaining', 'to', 'diversity', 'and', 'processes', 'of', 'diversification', 'both', 'theoretically', 'and', 'empirically', 'in', 'a', 'scientifically', 'sound', 'way', 'and', 'to', 'convey', 'the', 'general', 'relevance', 'of', 'social', 'processes', 'of', 'differentiation', 'to', 'laypersons', 'The', 'courses', 'are', 'taught', 'in', 'German', 'language', 'A', 'sufficient', 'German', 'language', 'proficiency', 'is', 'required', 'latest', 'by', 'matriculation', 'A', 'matriculation', 'without', 'a', 'proof', 'of', 'language', 'proficiency', 'is', 'not', 'possible', 'Career', 'prospects', 'The', 'knowledge', 'and', 'competences', 'taught', 'in', 'this', 'Master', 'programme', 'qualify', 'graduates', 'for', 'positions', 'in', 'various', 'fields', 'in', 'public', 'and', 'private', 'institutions', 'Possible', 'career', 'paths', 'include', 'working', 'as', 'diversity', 'or', 'equal', 'opportunities', 'officers', 'and', 'consultancy', 'especially', 'in', 'the', 'occupational', 'fields', 'of', 'social', 'integration', 'personnel', 'and', 'services', 'management', 'intercultural', 'opening', 'and', 'organizational', 'development', 'Potential', 'employers', 'include', 'businesses', 'university', 'and', 'science', 'management', 'NGOs', 'political', 'parties', 'social', 'and', 'educational', 'establishments', 'and', 'international', 'organizations', 'This', 'Master', 'degree', 'programme', 'also', 'provides', 'students', 'with', 'the', 'competencies', 'required', 'to', 'pursue', 'a']",2.2702222222222224
4,104,b-world-literature,"Programme description                
                                
                                
                                        
This study program will invite you to explore literature of all major world regions. The extraordinary variety of European and non-European philologies at the University of Göttingen allows for a global study of literature. You will read prominent works of literatures of the world and examine their temporal, spatial and cultural allocations. The degree program is aimed at applicants who want to turn their interest in literature into their profession or whose career goal requires broad cultural knowledge.
                                        
You will explore the European and the global interconnections of literature, recognizing how literary styles and periods have spread across borders. You will understand how texts allude to each other and how authors learn from each other. You will discover the literary richness of our world and investigate the cultures from which they originate. By evaluating literary techniques such as metaphor, rhyme or narrative perspective for interpretation, you will become aware of how literature works. You will study the specific possibilities of genres such as prose, lyric or drama. The program enables you to assess the qualities of literature. While working with literary texts you will learn and apply journalistic and scientific methods of analysis, which should help you prepare for a subsequent course of study or a professional career.

career opportunities
                                        
The abundance of course offers is naturally reflected in the available professional opportunities.
                                        
An internship at a German or foreign literary institution (publishing house, media, literary hub, press, radio, collection, archive, editing, literary museum) is recommended for the professional orientation and will be considered an accreditable part of the course program.
                                        
This course, mostly in combination with a secondary study, will prepare you to work in the following professional fields:
                                        
Literary agent
Publisher
Lecturer
Rights dealer
Translator
Writer
Editor
Manager of literary and art festivals, museums, fairs and exhibitions.",f,"['Programme', 'description', 'This', 'study', 'program', 'will', 'invite', 'you', 'to', 'explore', 'literature', 'of', 'all', 'major', 'world', 'regions', 'The', 'extraordinary', 'variety', 'of', 'European', 'and', 'non', 'European', 'philologies', 'at', 'the', 'University', 'of', 'Göttingen', 'allows', 'for', 'a', 'global', 'study', 'of', 'literature', 'You', 'will', 'read', 'prominent', 'works', 'of', 'literatures', 'of', 'the', 'world', 'and', 'examine', 'their', 'temporal', 'spatial', 'and', 'cultural', 'allocations', 'The', 'degree', 'program', 'is', 'aimed', 'at', 'applicants', 'who', 'want', 'to', 'turn', 'their', 'interest', 'in', 'literature', 'into', 'their', 'profession', 'or', 'whose', 'career', 'goal', 'requires', 'broad', 'cultural', 'knowledge', 'You', 'will', 'explore', 'the', 'European', 'and', 'the', 'global', 'interconnections', 'of', 'literature', 'recognizing', 'how', 'literary', 'styles', 'and', 'periods', 'have', 'spread', 'across', 'borders', 'You', 'will', 'understand', 'how', 'texts', 'allude', 'to', 'each', 'other', 'and', 'how', 'authors', 'learn', 'from', 'each', 'other', 'You', 'will', 'discover', 'the', 'literary', 'richness', 'of', 'our', 'world', 'and', 'investigate', 'the', 'cultures', 'from', 'which', 'they', 'originate', 'By', 'evaluating', 'literary', 'techniques', 'such', 'as', 'metaphor', 'rhyme', 'or', 'narrative', 'perspective', 'for', 'interpretation', 'you', 'will', 'become', 'aware', 'of', 'how', 'literature', 'works', 'You', 'will', 'study', 'the', 'specific', 'possibilities', 'of', 'genres', 'such', 'as', 'prose', 'lyric', 'or', 'drama', 'The', 'program', 'enables', 'you', 'to', 'assess', 'the', 'qualities', 'of', 'literature', 'While', 'working', 'with', 'literary', 'texts', 'you', 'will', 'learn', 'and', 'apply', 'journalistic', 'and', 'scientific', 'methods', 'of', 'analysis', 'which', 'should', 'help', 'you', 'prepare', 'for', 'a', 'subsequent', 'course', 'of', 'study', 'or', 'a', 'professional', 'career', 'career', 'opportunities', 'The', 'abundance', 'of', 'course', 'offers', 'is', 'naturally', 'reflected', 'in', 'the', 'available', 'professional', 'opportunities', 'An', 'internship', 'at', 'a', 'German', 'or', 'foreign', 'literary', 'institution', 'publishing', 'house', 'media', 'literary', 'hub', 'press', 'radio', 'collection', 'archive', 'editing', 'literary', 'museum', 'is', 'recommended', 'for', 'the', 'professional', 'orientation', 'and', 'will', 'be', 'considered', 'an', 'accreditable', 'part', 'of', 'the', 'course', 'program', 'This', 'course', 'mostly', 'in', 'combination', 'with', 'a', 'secondary', 'study', 'will', 'prepare', 'you', 'to', 'work', 'in', 'the', 'following', 'professional', 'fields', 'Literary', 'agent', 'Publisher', 'Lecturer', 'Rights', 'dealer', 'Translator', 'Writer', 'Editor', 'Manager', 'of', 'literary', 'and', 'art', 'festivals', 'museums', 'fairs', 'and', 'exhibitions']",2.5857627118644073
5,105,b-appl-computer-science,"What is Computer Science?

Computer Science is the science of systematic and automated processing of information. It deals with the structures, characteristics and description possibilities of information and information processing as well as the set-up, working methods and construction principles of computer systems. General working methods in information processing and general methods of their application in different fields are explored. Contents also include the development of experimental and product-oriented information processing systems of modern conception. Computer Science can be subdivided into the areas of Theoretical Computer Science, Practical Computer Science, Technical Computer Sciences as well as Applied Computer Science.

Students will deal with the possibilities of structuring, formalizing and mathematising application areas in the form of special models and simulations. They will acquire knowledge in the engineering aspect of software system development for different application areas under special consideration of the high adaptability and man-computer-interaction of such systems.

The programme aims to convey the basic knowledge of the subject of Computer Science in theory and practice as well as in regards to an application subject. This comprises methods to solve application problems and their implementation in a computer-suited form.

Special emphasis is placed on the close connection with the application subject. In addition, the practical reference can be expanded with external internships, which are to take place in an industrial business or a research institution.

Whoever chooses to study Computer Science should be interested in a mathematical formal as well as application-related practical working method. The ability to work in a team is an important requirement for a later occupation. Knowledge of the English language, especially in programming, is not required.
Why study in Göttingen?

Do you enjoy working with computers or mathematics, but are also interested in biology, economics, medicine or the humanities? Then Göttingen is the right place for you!

You can study Computer Science in Göttingen as Applied Computer Science in the Bachelor's and Master's programmes. During your studies, we will teach you the theoretical and mathematical basics of computer science and offer you the opportunity to further deepen your knowledge of the broad range of topics in core computer science. Depending on your interests, you can also choose a major to specialise in an application area. This will give you an insight into the latest technologies used in the respective subject areas and experience research-oriented teaching in very different, subject-specific and sometimes very practical forms of teaching.

Possible specialisations include, for example, business informatics, neuroinformatics, bioinformatics or geoinformatics.

 Complete overview of the specialisations

Occupational fields

Studying at the Institute of Computer Science at Göttingen University enables you to enter innovative professional fields. With a sound education in the field of applied computer science, you can contribute to the technologies of the future, whether in medicine and biotechnology, business, the geosciences or environmental technology and ecosystem research.

Computer scientists are needed in more and more disciplines. They work in banks, industrial companies or social institutions, at universities or in cancer research, they develop computer games and apps as well as robots, medical technology applications and much more. Typical fields of work are:

 Soft and hardware development
 Further development and adaptation of application systems and networks
 Counselling and training
 Research and teaching

By choosing an application subject in the Applied Computer Science degree programme, possible occupational fields become even more differentiated. The career opportunities for graduates of Applied Computer Science are excellent due to the interdisciplinary study programme.",m,"['What', 'is', 'Computer', 'Science', 'Computer', 'Science', 'is', 'the', 'science', 'of', 'systematic', 'and', 'automated', 'processing', 'of', 'information', 'It', 'deals', 'with', 'the', 'structures', 'characteristics', 'and', 'description', 'possibilities', 'of', 'information', 'and', 'information', 'processing', 'as', 'well', 'as', 'the', 'set', 'up', 'working', 'methods', 'and', 'construction', 'principles', 'of', 'computer', 'systems', 'General', 'working', 'methods', 'in', 'information', 'processing', 'and', 'general', 'methods', 'of', 'their', 'application', 'in', 'different', 'fields', 'are', 'explored', 'Contents', 'also', 'include', 'the', 'development', 'of', 'experimental', 'and', 'product', 'oriented', 'information', 'processing', 'systems', 'of', 'modern', 'conception', 'Computer', 'Science', 'can', 'be', 'subdivided', 'into', 'the', 'areas', 'of', 'Theoretical', 'Computer', 'Science', 'Practical', 'Computer', 'Science', 'Technical', 'Computer', 'Sciences', 'as', 'well', 'as', 'Applied', 'Computer', 'Science', 'Students', 'will', 'deal', 'with', 'the', 'possibilities', 'of', 'structuring', 'formalizing', 'and', 'mathematising', 'application', 'areas', 'in', 'the', 'form', 'of', 'special', 'models', 'and', 'simulations', 'They', 'will', 'acquire', 'knowledge', 'in', 'the', 'engineering', 'aspect', 'of', 'software', 'system', 'development', 'for', 'different', 'application', 'areas', 'under', 'special', 'consideration', 'of', 'the', 'high', 'adaptability', 'and', 'man', 'computer', 'interaction', 'of', 'such', 'systems', 'The', 'programme', 'aims', 'to', 'convey', 'the', 'basic', 'knowledge', 'of', 'the', 'subject', 'of', 'Computer', 'Science', 'in', 'theory', 'and', 'practice', 'as', 'well', 'as', 'in', 'regards', 'to', 'an', 'application', 'subject', 'This', 'comprises', 'methods', 'to', 'solve', 'application', 'problems', 'and', 'their', 'implementation', 'in', 'a', 'computer', 'suited', 'form', 'Special', 'emphasis', 'is', 'placed', 'on', 'the', 'close', 'connection', 'with', 'the', 'application', 'subject', 'In', 'addition', 'the', 'practical', 'reference', 'can', 'be', 'expanded', 'with', 'external', 'internships', 'which', 'are', 'to', 'take', 'place', 'in', 'an', 'industrial', 'business', 'or', 'a', 'research', 'institution', 'Whoever', 'chooses', 'to', 'study', 'Computer', 'Science', 'should', 'be', 'interested', 'in', 'a', 'mathematical', 'formal', 'as', 'well', 'as', 'application', 'related', 'practical', 'working', 'method', 'The', 'ability', 'to', 'work', 'in', 'a', 'team', 'is', 'an', 'important', 'requirement', 'for', 'a', 'later', 'occupation', 'Knowledge', 'of', 'the', 'English', 'language', 'especially', 'in', 'programming', 'is', 'not', 'required', 'Why', 'study', 'in', 'Göttingen', 'Do', 'you', 'enjoy', 'working', 'with', 'computers', 'or', 'mathematics', 'but', 'are', 'also', 'interested', 'in', 'biology', 'economics', 'medicine', 'or', 'the', 'humanities', 'Then', 'Göttingen', 'is', 'the', 'right', 'place', 'for', 'you', 'You', 'can', 'study', 'Computer', 'Science', 'in', 'Göttingen', 'as', 'Applied', 'Computer', 'Science', 'in', 'the', 'Bachelor', 'and', 'Master', 'programmes', 'During', 'your', 'studies', 'we', 'will', 'teach', 'you', 'the', 'theoretical', 'and', 'mathematical', 'basics', 'of', 'computer', 'science', 'and', 'offer', 'you', 'the', 'opportunity', 'to', 'further', 'deepen', 'your', 'knowledge', 'of', 'the', 'broad', 'range', 'of', 'topics', 'in', 'core', 'computer', 'science', 'Depending', 'on', 'your', 'interests', 'you', 'can', 'also', 'choose', 'a', 'major', 'to', 'specialise', 'in', 'an', 'application', 'area', 'This', 'will', 'give', 'you', 'an', 'insight', 'into', 'the', 'latest', 'technologies', 'used', 'in', 'the', 'respective', 'subject', 'areas', 'and', 'experience', 'research', 'oriented', 'teaching', 'in', 'very', 'different', 'subject', 'specific', 'and', 'sometimes', 'very', 'practical', 'forms', 'of', 'teaching', 'Possible', 'specialisations', 'include', 'for', 'example', 'business', 'informatics', 'neuroinformatics', 'bioinformatics', 'or', 'geoinformatics', 'Complete', 'overview', 'of', 'the', 'specialisations', 'Occupational', 'fields', 'Studying', 'at', 'the', 'Institute', 'of', 'Computer', 'Science', 'at', 'Göttingen', 'University', 'enables', 'you', 'to', 'enter', 'innovative', 'professional', 'fields', 'With', 'a', 'sound', 'education', 'in', 'the', 'field', 'of', 'applied', 'computer', 'science', 'you', 'can', 'contribute', 'to', 'the', 'technologies', 'of', 'the', 'future', 'whether', 'in', 'medicine', 'and', 'biotechnology', 'business', 'the', 'geosciences', 'or', 'environmental', 'technology', 'and', 'ecosystem', 'research', 'Computer', 'scientists', 'are', 'needed', 'in', 'more', 'and', 'more', 'disciplines', 'They', 'work', 'in', 'banks', 'industrial', 'companies', 'or', 'social', 'institutions', 'at', 'universities', 'or', 'in', 'cancer', 'research', 'they', 'develop', 'computer', 'games', 'and', 'apps', 'as', 'well', 'as', 'robots', 'medical', 'technology', 'applications', 'and', 'much', 'more', 'Typical', 'fields', 'of', 'work', 'are', 'Soft', 'and', 'hardware', 'development', 'Further', 'development', 'and', 'adaptation', 'of', 'application', 'systems', 'and', 'networks', 'Counselling', 'and', 'training', 'Research', 'and', 'teaching', 'By', 'choosing', 'an', 'application', 'subject', 'in', 'the', 'Applied', 'Computer', 'Science', 'degree', 'programme', 'possible', 'occupational', 'fields', 'become', 'even', 'more', 'differentiated', 'The', 'career', 'opportunities', 'for', 'graduates', 'of', 'Applied', 'Computer', 'Science', 'are', 'excellent', 'due', 'to', 'the', 'interdisciplinary', 'study', 'programme']",2.5692397660818713
6,106,m-appl-computer-science,"Program Description
Computer science is the science of systematic and automated processing of information. It deals with the structures, characteristics and possibilities to describe information and information processing as well as the setup, working method and construction principles of computer systems. General procedural methods of information processing and general methods of their application are researched. The programme contents include the development of modern experimental and product oriented information processing systems. Computer science can be divided into the areas of theoretical computer science, practical computer science, technical computer science as well as applied computer science.
Students will deal with the possibilities of structuring, formalisation and mathematization of application areas in the form of special models and simulations. They will acquire knowledge in engineering development of software systems for different areas of application with special consideration of high adaptability and the man-computer interaction of such systems.
The programme aims to convey extensive knowledge in the subject of computer science in theory and practice as well as with reference to an application subject. This comprises methods to solve application problems and their realization in an appropriate computer form.
General Information
The Göttingen master's program in Applied Computer Science is characterized in particular by its interdisciplinary profile. In cooperation with other faculties of the University of Göttingen, we offer a variety of study specialisations. By choosing one of these specialisations, you will gain in-depth knowledge in an application domain and will be able to contribute to current research topics in the corresponding application area.
Occupational fields
Studying at the Institute of Computer Science at the University of Göttingen enables you to enter innovative professional fields. With a solid education in applied computer science, you can contribute to the technologies of the future, whether in medicine and biotechnology, business, the geosciences, or environmental technology and ecosystem research.
Computer scientists are required in almost all subject disciplines. They work in banks, industrial companies or social institutions, at universities or in cancer research, they develop computer games and apps as well as robots, medical technology applications and much more.
Typical fields of work include:
software and hardware development
further development and adaptation of application systems and networks
consulting and training
research and development
Different fields of work are also possible depending on the application subject. Career prospects for graduates of Applied Computer Science are very good due to the interdisciplinary programme.",m,"['Program', 'Description', 'Computer', 'science', 'is', 'the', 'science', 'of', 'systematic', 'and', 'automated', 'processing', 'of', 'information', 'It', 'deals', 'with', 'the', 'structures', 'characteristics', 'and', 'possibilities', 'to', 'describe', 'information', 'and', 'information', 'processing', 'as', 'well', 'as', 'the', 'setup', 'working', 'method', 'and', 'construction', 'principles', 'of', 'computer', 'systems', 'General', 'procedural', 'methods', 'of', 'information', 'processing', 'and', 'general', 'methods', 'of', 'their', 'application', 'are', 'researched', 'The', 'programme', 'contents', 'include', 'the', 'development', 'of', 'modern', 'experimental', 'and', 'product', 'oriented', 'information', 'processing', 'systems', 'Computer', 'science', 'can', 'be', 'divided', 'into', 'the', 'areas', 'of', 'theoretical', 'computer', 'science', 'practical', 'computer', 'science', 'technical', 'computer', 'science', 'as', 'well', 'as', 'applied', 'computer', 'science', 'Students', 'will', 'deal', 'with', 'the', 'possibilities', 'of', 'structuring', 'formalisation', 'and', 'mathematization', 'of', 'application', 'areas', 'in', 'the', 'form', 'of', 'special', 'models', 'and', 'simulations', 'They', 'will', 'acquire', 'knowledge', 'in', 'engineering', 'development', 'of', 'software', 'systems', 'for', 'different', 'areas', 'of', 'application', 'with', 'special', 'consideration', 'of', 'high', 'adaptability', 'and', 'the', 'man', 'computer', 'interaction', 'of', 'such', 'systems', 'The', 'programme', 'aims', 'to', 'convey', 'extensive', 'knowledge', 'in', 'the', 'subject', 'of', 'computer', 'science', 'in', 'theory', 'and', 'practice', 'as', 'well', 'as', 'with', 'reference', 'to', 'an', 'application', 'subject', 'This', 'comprises', 'methods', 'to', 'solve', 'application', 'problems', 'and', 'their', 'realization', 'in', 'an', 'appropriate', 'computer', 'form', 'General', 'Information', 'The', 'Göttingen', 'master', 'program', 'in', 'Applied', 'Computer', 'Science', 'is', 'characterized', 'in', 'particular', 'by', 'its', 'interdisciplinary', 'profile', 'In', 'cooperation', 'with', 'other', 'faculties', 'of', 'the', 'University', 'of', 'Göttingen', 'we', 'offer', 'a', 'variety', 'of', 'study', 'specialisations', 'By', 'choosing', 'one', 'of', 'these', 'specialisations', 'you', 'will', 'gain', 'in', 'depth', 'knowledge', 'in', 'an', 'application', 'domain', 'and', 'will', 'be', 'able', 'to', 'contribute', 'to', 'current', 'research', 'topics', 'in', 'the', 'corresponding', 'application', 'area', 'Occupational', 'fields', 'Studying', 'at', 'the', 'Institute', 'of', 'Computer', 'Science', 'at', 'the', 'University', 'of', 'Göttingen', 'enables', 'you', 'to', 'enter', 'innovative', 'professional', 'fields', 'With', 'a', 'solid', 'education', 'in', 'applied', 'computer', 'science', 'you', 'can', 'contribute', 'to', 'the', 'technologies', 'of', 'the', 'future', 'whether', 'in', 'medicine', 'and', 'biotechnology', 'business', 'the', 'geosciences', 'or', 'environmental', 'technology', 'and', 'ecosystem', 'research', 'Computer', 'scientists', 'are', 'required', 'in', 'almost', 'all', 'subject', 'disciplines', 'They', 'work', 'in', 'banks', 'industrial', 'companies', 'or', 'social', 'institutions', 'at', 'universities', 'or', 'in', 'cancer', 'research', 'they', 'develop', 'computer', 'games', 'and', 'apps', 'as', 'well', 'as', 'robots', 'medical', 'technology', 'applications', 'and', 'much', 'more', 'Typical', 'fields', 'of', 'work', 'include', 'software', 'and', 'hardware', 'development', 'further', 'development', 'and', 'adaptation', 'of', 'application', 'systems', 'and', 'networks', 'consulting', 'and', 'training', 'research', 'and', 'development', 'Different', 'fields', 'of', 'work', 'are', 'also', 'possible', 'depending', 'on', 'the', 'application', 'subject', 'Career', 'prospects', 'for', 'graduates', 'of', 'Applied', 'Computer', 'Science', 'are', 'very', 'good', 'due', 'to', 'the', 'interdisciplinary', 'programme']",2.5446212121212124
