,program-id,program name,program description,dominant gender immatriculation,cleaned wordlists,brysbaert score
11,111,b-musicology,"What does musicology do?                                                                  
                                                                
Music is not just something people listen to or do: it is also something people study. Musicology is the science of music: it is about finding out what music actually is, how it works, and what it means to people. And it is about fundamentally thinking about what we can learn about people, their culture, their history(s) and their webs of relationships through music.                                
Musicology views music as a human practice that has a wide variety of forms and meanings through the diversity of the world's cultures and historical change. At the Göttingen Department of Musicology, we are convinced that there is not one music, but many musics. Music can be studied in many manifestations: as a communicative expression, as a system of knowledge, as part of cultural action and cultural identity. Music can be analysed as a work of art or as a function of a social network within a society. Music can be used as a medium for feelings, ideas and self-understandings, or as an instrument of (powerlessness) power.
                                
This plurality is also reflected in the means of researching music. The focus here is on thinking about music as well as thinking through music and sound, for which we have the following repertoires of methods at our disposal:
                                 
Historical research (evaluation of written, sound and visual sources)
field research (participant observation of music practices)
Hearing analysis, musical text analysis
Analysis of sound as a mode of knowledge
Computer-assisted analysis (e.g. spectral or frequency analysis)
                                
                                        
Occupational fields                                                                  
                            
                                
                                        
Completion of a Bachelor's degree in Musicology will qualify you for a great variety of occupations in culture management and politics, in the area of the media and public relations, at theatres, in the library sector and related areas. The Bachelor's degree in the subject of Musicology can serve, in particular, as the basis for a Master's degree programme in Musicology or a related subject.                         
                
                                
                                        
Recommended prior knowledge in music                                                                  
You should have sufficient basic knowledge of music (musical terminology, notation) and musical theory (intervals, keys, chords). Basic skills in playing instruments or singing will be of advantage. You should also be experienced in listening to a wide range of different styles of music. ",n,"['What', 'does', 'musicology', 'do', 'Music', 'is', 'not', 'just', 'something', 'people', 'listen', 'to', 'or', 'do', 'it', 'is', 'also', 'something', 'people', 'study', 'Musicology', 'is', 'the', 'science', 'of', 'music', 'it', 'is', 'about', 'finding', 'out', 'what', 'music', 'actually', 'is', 'how', 'it', 'works', 'and', 'what', 'it', 'means', 'to', 'people', 'And', 'it', 'is', 'about', 'fundamentally', 'thinking', 'about', 'what', 'we', 'can', 'learn', 'about', 'people', 'their', 'culture', 'their', 'and', 'their', 'webs', 'of', 'relationships', 'through', 'music', 'Musicology', 'views', 'music', 'as', 'a', 'human', 'practice', 'that', 'has', 'a', 'wide', 'variety', 'of', 'forms', 'and', 'meanings', 'through', 'the', 'diversity', 'of', 'the', 'world', 'cultures', 'and', 'historical', 'change', 'At', 'the', 'Göttingen', 'Department', 'of', 'Musicology', 'we', 'are', 'convinced', 'that', 'there', 'is', 'not', 'one', 'music', 'but', 'many', 'musics', 'Music', 'can', 'be', 'studied', 'in', 'many', 'manifestations', 'as', 'a', 'communicative', 'expression', 'as', 'a', 'system', 'of', 'knowledge', 'as', 'part', 'of', 'cultural', 'action', 'and', 'cultural', 'identity', 'Music', 'can', 'be', 'analysed', 'as', 'a', 'work', 'of', 'art', 'or', 'as', 'a', 'function', 'of', 'a', 'social', 'network', 'within', 'a', 'society', 'Music', 'can', 'be', 'used', 'as', 'a', 'medium', 'for', 'feelings', 'ideas', 'and', 'self', 'understandings', 'or', 'as', 'an', 'instrument', 'of', 'powerlessness', 'power', 'This', 'plurality', 'is', 'also', 'reflected', 'in', 'the', 'means', 'of', 'researching', 'music', 'The', 'focus', 'here', 'is', 'on', 'thinking', 'about', 'music', 'as', 'well', 'as', 'thinking', 'through', 'music', 'and', 'sound', 'for', 'which', 'we', 'have', 'the', 'following', 'repertoires', 'of', 'methods', 'at', 'our', 'disposal', 'Historical', 'research', 'evaluation', 'of', 'written', 'sound', 'and', 'visual', 'sources', 'field', 'research', 'participant', 'observation', 'of', 'music', 'practices', 'Hearing', 'analysis', 'musical', 'text', 'analysis', 'Analysis', 'of', 'sound', 'as', 'a', 'mode', 'of', 'knowledge', 'Computer', 'assisted', 'analysis', 'spectral', 'or', 'frequency', 'analysis', 'Occupational', 'fields', 'Completion', 'of', 'a', 'Bachelor', 'degree', 'in', 'Musicology', 'will', 'qualify', 'you', 'for', 'a', 'great', 'variety', 'of', 'occupations', 'in', 'culture', 'management', 'and', 'politics', 'in', 'the', 'area', 'of', 'the', 'media', 'and', 'public', 'relations', 'at', 'theatres', 'in', 'the', 'library', 'sector', 'and', 'related', 'areas', 'The', 'Bachelor', 'degree', 'in', 'the', 'subject', 'of', 'Musicology', 'can', 'serve', 'in', 'particular', 'as', 'the', 'basis', 'for', 'a', 'Master', 'degree', 'programme', 'in', 'Musicology', 'or', 'a', 'related', 'subject', 'Recommended', 'prior', 'knowledge', 'in', 'music', 'You', 'should', 'have', 'sufficient', 'basic', 'knowledge', 'of', 'music', 'musical', 'terminology', 'notation', 'and', 'musical', 'theory', 'intervals', 'keys', 'chords', 'Basic', 'skills', 'in', 'playing', 'instruments', 'or', 'singing', 'will', 'be', 'of', 'advantage', 'You', 'should', 'also', 'be', 'experienced', 'in', 'listening', 'to', 'a', 'wide', 'range', 'of', 'different', 'styles', 'of', 'music']",2.6324812030075186
12,112,b-archeology,"subject/content/objectives
                                        
They are introduced to Greek, Roman and Byzantine culture and ancient history through introductory lectures and tutorials. The degree programme takes into account the current academic trend towards cultural anthropological questions and interdisciplinary field research. This is achieved by means of integrative cultural-comparative courses in cooperation with neighbouring disciplines as well as high practical components. You can take internal and external practical courses, for example in excavation technology, surveying technology, drawing and photographic object documentation, digital image processing, ceramic analysis and restoration, moulding techniques, museology, monument preservation, archaeological science journalism with the corresponding career-qualifying perspectives.
                                        
Examination results are usually achieved by giving presentations and writing assignments. In this way, you will thoroughly learn how to work scientifically and acquire numerous additional competences:
                                        
Targeted research of information,
Evaluation of the information and argumentation based on it,
Presentation of the results achieved, i.e. the ability to express oneself verbally, visually and in writing.
                                        
The Archaeological Institute's networks at home and abroad allow you mobility (e.g. Erasmus) already in the Bachelor's programme.
                                        
In addition, the students are thus well prepared for writing their final thesis and actively shape their courses through the presentations.
                                
subject area and research foci
                                        
Basically, two subjects are combined in one degree programme! Classical Archaeology deals with earlier antiquity, Christian Archaeology/Byzantine Art History with later antiquity. They therefore build on each other. The Bachelor's degree programme makes use of the common methodological foundations as well as overlaps in content. In addition, students gain an insight into the various research foci of the lecturers (e.g. political and religious iconography, stylistic analysis, cultural contacts, gender, architecture, landscape, liturgy).
                                        
The Archaeological Institute in Göttingen offers you excellent libraries and, above all, 250-year-old collections of ancient originals, casts of ancient sculptures and coins. They are continuously used in the courses. Already in early semesters, students come into direct contact with archaeological material. The institute's restoration workshop offers students important practice. There are cooperations with the museums in Kassel, Hanover and Frankfurt. Internships can be completed there during the practical part of the programme. Numerous field research projects in Italy, Greece and Spain also offer favourable conditions for quickly gaining practical archaeological experience.
                                        
The multifaceted study of archaeology in Göttingen creates the best opportunities for training and research, especially in the fields of ancient sculpture and iconography, architecture, historical regional studies, numismatics and the reception of antiquity.
                                
occupational fields
The programme conveys knowledge as well as methodical and practical skills, enabling graduates to qualify for occupations in the fields of youth and adult education, culture management, tourism, publishing houses, the press, new media, diplomatic institutions, international organisations, etc. Graduates also have the possibility to continue their studies in a Master's programme to prepare themselves for a scientific career path in fields related to museums, the conservation of ancient monuments, universities as well as non-university research institutions.",n,"['subject', 'content', 'objectives', 'They', 'are', 'introduced', 'to', 'Greek', 'Roman', 'and', 'Byzantine', 'culture', 'and', 'ancient', 'history', 'through', 'introductory', 'lectures', 'and', 'tutorials', 'The', 'degree', 'programme', 'takes', 'into', 'account', 'the', 'current', 'academic', 'trend', 'towards', 'cultural', 'anthropological', 'questions', 'and', 'interdisciplinary', 'field', 'research', 'This', 'is', 'achieved', 'by', 'means', 'of', 'integrative', 'cultural', 'comparative', 'courses', 'in', 'cooperation', 'with', 'neighbouring', 'disciplines', 'as', 'well', 'as', 'high', 'practical', 'components', 'You', 'can', 'take', 'internal', 'and', 'external', 'practical', 'courses', 'for', 'example', 'in', 'excavation', 'technology', 'surveying', 'technology', 'drawing', 'and', 'photographic', 'object', 'documentation', 'digital', 'image', 'processing', 'ceramic', 'analysis', 'and', 'restoration', 'moulding', 'techniques', 'museology', 'monument', 'preservation', 'archaeological', 'science', 'journalism', 'with', 'the', 'corresponding', 'career', 'qualifying', 'perspectives', 'Examination', 'results', 'are', 'usually', 'achieved', 'by', 'giving', 'presentations', 'and', 'writing', 'assignments', 'In', 'this', 'way', 'you', 'will', 'thoroughly', 'learn', 'how', 'to', 'work', 'scientifically', 'and', 'acquire', 'numerous', 'additional', 'competences', 'Targeted', 'research', 'of', 'information', 'Evaluation', 'of', 'the', 'information', 'and', 'argumentation', 'based', 'on', 'it', 'Presentation', 'of', 'the', 'results', 'achieved', 'the', 'ability', 'to', 'express', 'oneself', 'verbally', 'visually', 'and', 'in', 'writing', 'The', 'Archaeological', 'Institute', 'networks', 'at', 'home', 'and', 'abroad', 'allow', 'you', 'mobility', 'Erasmus', 'already', 'in', 'the', 'Bachelor', 'programme', 'In', 'addition', 'the', 'students', 'are', 'thus', 'well', 'prepared', 'for', 'writing', 'their', 'final', 'thesis', 'and', 'actively', 'shape', 'their', 'courses', 'through', 'the', 'presentations', 'subject', 'area', 'and', 'research', 'foci', 'Basically', 'two', 'subjects', 'are', 'combined', 'in', 'one', 'degree', 'programme', 'Classical', 'Archaeology', 'deals', 'with', 'earlier', 'antiquity', 'Christian', 'Archaeology', 'Byzantine', 'Art', 'History', 'with', 'later', 'antiquity', 'They', 'therefore', 'build', 'on', 'each', 'other', 'The', 'Bachelor', 'degree', 'programme', 'makes', 'use', 'of', 'the', 'common', 'methodological', 'foundations', 'as', 'well', 'as', 'overlaps', 'in', 'content', 'In', 'addition', 'students', 'gain', 'an', 'insight', 'into', 'the', 'various', 'research', 'foci', 'of', 'the', 'lecturers', 'political', 'and', 'religious', 'iconography', 'stylistic', 'analysis', 'cultural', 'contacts', 'gender', 'architecture', 'landscape', 'liturgy', 'The', 'Archaeological', 'Institute', 'in', 'Göttingen', 'offers', 'you', 'excellent', 'libraries', 'and', 'above', 'all', 'year', 'old', 'collections', 'of', 'ancient', 'originals', 'casts', 'of', 'ancient', 'sculptures', 'and', 'coins', 'They', 'are', 'continuously', 'used', 'in', 'the', 'courses', 'Already', 'in', 'early', 'semesters', 'students', 'come', 'into', 'direct', 'contact', 'with', 'archaeological', 'material', 'The', 'institute', 'restoration', 'workshop', 'offers', 'students', 'important', 'practice', 'There', 'are', 'cooperations', 'with', 'the', 'museums', 'in', 'Kassel', 'Hanover', 'and', 'Frankfurt', 'Internships', 'can', 'be', 'completed', 'there', 'during', 'the', 'practical', 'part', 'of', 'the', 'programme', 'Numerous', 'field', 'research', 'projects', 'in', 'Italy', 'Greece', 'and', 'Spain', 'also', 'offer', 'favourable', 'conditions', 'for', 'quickly', 'gaining', 'practical', 'archaeological', 'experience', 'The', 'multifaceted', 'study', 'of', 'archaeology', 'in', 'Göttingen', 'creates', 'the', 'best', 'opportunities', 'for', 'training', 'and', 'research', 'especially', 'in', 'the', 'fields', 'of', 'ancient', 'sculpture', 'and', 'iconography', 'architecture', 'historical', 'regional', 'studies', 'numismatics', 'and', 'the', 'reception', 'of', 'antiquity', 'occupational', 'fields', 'The', 'programme', 'conveys', 'knowledge', 'as', 'well', 'as', 'methodical', 'and', 'practical', 'skills', 'enabling', 'graduates', 'to', 'qualify', 'for', 'occupations', 'in', 'the', 'fields', 'of', 'youth', 'and', 'adult', 'education', 'culture', 'management', 'tourism', 'publishing', 'houses', 'the', 'press', 'new', 'media', 'diplomatic', 'institutions', 'international', 'organisations', 'etc', 'Graduates', 'also', 'have', 'the', 'possibility', 'to', 'continue', 'their', 'studies', 'in', 'a', 'Master', 'programme', 'to', 'prepare', 'themselves', 'for', 'a', 'scientific', 'career', 'path', 'in', 'fields', 'related', 'to', 'museums', 'the', 'conservation', 'of', 'ancient', 'monuments', 'universities', 'as', 'well', 'as', 'non', 'university', 'research', 'institutions']",2.650432432432432
13,113,b-business-and-human-resource-education,"general information: what is is all about?
This interdisciplinary programme in Business and Human Resource Education primarily prepares students for a job as teachers at vocational schools. Students with the professional goal of becoming Teachers at vocational schools have to follow the Master's programme in Business and Human Resource Education after their bachelor's degree and can then enter the German school system (Referendariat).
Through the interdisciplinary combination of economics, pedagogy as well as another freely selectable teaching subject, our bachelor's programme integrates different subject perspectives. In this way, you learn to integrate information and findings from different disciplines in order to look at issues from an economic, pedagogical and educational policy perspective. This enables you to gain a holistic understanding of the topics and promotes an interdisciplinary approach that will help you in your day-to-day professional practice.
Specialised knowledge is not enough to be successful in teaching in vocational schools or in business. Our degree programme therefore provides you with the skills you need: For example, the basics of teaching and learning, didactic skills such as communicating complex content in a comprehensible way or giving constructive feedback, but also organisational knowledge, for example, about the structure and processes in the vocational training system or about education management issues. You can apply this directly in practice. Furthermore, you will complete an internship (usually in vocational schools) during your studies in which you will put your theoretical knowledge into practice and gain insights into real work processes.

career opportunities
The polyvalent orientation of our bachelor's programme opens up a variety of career paths for you. For example, it qualifies you for the Master’s degree in Business and Human Resource Education, which allows you to work at state vocational schools or in education management in public administration, such as ministries of education or school boards, after graduation. With the bachelor's degree, a job in the economy is open to you - for example, in the personnel development of companies or with independent educational providers and private educational institutions.",n,"['general', 'information', 'what', 'is', 'is', 'all', 'about', 'This', 'interdisciplinary', 'programme', 'in', 'Business', 'and', 'Human', 'Resource', 'Education', 'primarily', 'prepares', 'students', 'for', 'a', 'job', 'as', 'teachers', 'at', 'vocational', 'schools', 'Students', 'with', 'the', 'professional', 'goal', 'of', 'becoming', 'Teachers', 'at', 'vocational', 'schools', 'have', 'to', 'follow', 'the', 'Master', 'programme', 'in', 'Business', 'and', 'Human', 'Resource', 'Education', 'after', 'their', 'bachelor', 'degree', 'and', 'can', 'then', 'enter', 'the', 'German', 'school', 'system', 'Referendariat', 'Through', 'the', 'interdisciplinary', 'combination', 'of', 'economics', 'pedagogy', 'as', 'well', 'as', 'another', 'freely', 'selectable', 'teaching', 'subject', 'our', 'bachelor', 'programme', 'integrates', 'different', 'subject', 'perspectives', 'In', 'this', 'way', 'you', 'learn', 'to', 'integrate', 'information', 'and', 'findings', 'from', 'different', 'disciplines', 'in', 'order', 'to', 'look', 'at', 'issues', 'from', 'an', 'economic', 'pedagogical', 'and', 'educational', 'policy', 'perspective', 'This', 'enables', 'you', 'to', 'gain', 'a', 'holistic', 'understanding', 'of', 'the', 'topics', 'and', 'promotes', 'an', 'interdisciplinary', 'approach', 'that', 'will', 'help', 'you', 'in', 'your', 'day', 'to', 'day', 'professional', 'practice', 'Specialised', 'knowledge', 'is', 'not', 'enough', 'to', 'be', 'successful', 'in', 'teaching', 'in', 'vocational', 'schools', 'or', 'in', 'business', 'Our', 'degree', 'programme', 'therefore', 'provides', 'you', 'with', 'the', 'skills', 'you', 'need', 'For', 'example', 'the', 'basics', 'of', 'teaching', 'and', 'learning', 'didactic', 'skills', 'such', 'as', 'communicating', 'complex', 'content', 'in', 'a', 'comprehensible', 'way', 'or', 'giving', 'constructive', 'feedback', 'but', 'also', 'organisational', 'knowledge', 'for', 'example', 'about', 'the', 'structure', 'and', 'processes', 'in', 'the', 'vocational', 'training', 'system', 'or', 'about', 'education', 'management', 'issues', 'You', 'can', 'apply', 'this', 'directly', 'in', 'practice', 'Furthermore', 'you', 'will', 'complete', 'an', 'internship', 'usually', 'in', 'vocational', 'schools', 'during', 'your', 'studies', 'in', 'which', 'you', 'will', 'put', 'your', 'theoretical', 'knowledge', 'into', 'practice', 'and', 'gain', 'insights', 'into', 'real', 'work', 'processes', 'career', 'opportunities', 'The', 'polyvalent', 'orientation', 'of', 'our', 'bachelor', 'programme', 'opens', 'up', 'a', 'variety', 'of', 'career', 'paths', 'for', 'you', 'For', 'example', 'it', 'qualifies', 'you', 'for', 'the', 'Master', 'degree', 'in', 'Business', 'and', 'Human', 'Resource', 'Education', 'which', 'allows', 'you', 'to', 'work', 'at', 'state', 'vocational', 'schools', 'or', 'in', 'education', 'management', 'in', 'public', 'administration', 'such', 'as', 'ministries', 'of', 'education', 'or', 'school', 'boards', 'after', 'graduation', 'With', 'the', 'bachelor', 'degree', 'a', 'job', 'in', 'the', 'economy', 'is', 'open', 'to', 'you', 'for', 'example', 'in', 'the', 'personnel', 'development', 'of', 'companies', 'or', 'with', 'independent', 'educational', 'providers', 'and', 'private', 'educational', 'institutions']",2.4484166666666662
