,program-id,program name,program description,dominant gender immatriculation,cleaned wordlists,brysbaert score
7,107,b-business-informatics,"General information: What is it all about?

As an interdisciplinary subject, the business information systems degree programme is composed of economic content, primarily business administration, informatics content, and additional business informatics content. Information management, system development and system selection as well as (business) application systems, for example, are fundamental subfields of the business information systems degree programme. In your studies, you will deal with topics such as the design of application systems, mobile applications, data management and machine learning. The generous elective area gives you the opportunity to get to know many different subject areas in order to discover new interests - also through modules outside of business informatics and economics.

You must be able to apply your knowledge in reality. Therefore, all modules are designed to establish a link to practice and to smooth your transition into professional life in the fast-moving IT industries through up-to-date content. In the project seminar on system development, you will design and accompany - also in cooperation with practical partners from the business world - the complete development of a software solution.

In hardly any other industry does the relevant knowledge change as quickly as in IT. We prepare you optimally for this dynamic professional field: On the one hand, we teach you practical and cutting-edge content and, on the other hand, timeless methods that will help you to familiarise yourself with new tasks throughout your entire professional life.

The programme is completely modularised, i.e. credits are acquired during studies. The programme is successfully completed when 180 credits have been earned.

Prerequisites/ Personal skills

For a qualified bachelor's programme in the field of economics, students must especially have sound knowledge in the English language (international students also must have good German language skills), mathematics as well as information and communications systems (ICS).

Students whose knowledge of English/ German, mathematics or ICS is poor are strongly suggested to improve in these areas before beginning with the programme. The Faculty of Business and Economics also offers a precourse in Mathematics for new students to prepare them for the following modules in Mathematics (every winter and summer semester).
Selection procedure and admission criteria

Admission to the Bachelor's degree programme in Business Information Systems is restricted in the first subject-related semester, while the higher subject-related semesters are not subject to admission restrictions. Students can apply and be enrolled in both the summer and winter semesters.

What we expect from you:

 Motivation and a will to achieve
 Interest in entrepreneurial or macroeconomic issues
 Analytical thinking faculties as well as an interest in and ability to deal with mathematical methods of presentation
 Good proficiency in German, a good or at least working knowledge of the English language

Career perspectives

As a graduate with a bachelor degree, you will have career opportunities in a multitude of professions. The labour market continues to be characterised by a strong demand for highly qualified information technology (IT) specialists.

Core occupations for graduates of the Bachelor's programme in Business Information Systems include jobs as computer specialists and system analysts. Bachelor degree graduates will be tasked with planning, documenting and rolling out hardware and software and gathering data on the impacts on organisational forms. This additionally involves support in solving problems and the modification or new development of concepts. Concrete jobs for graduates with a bachelor degree include jobs as specialists at computing centres and user services, organisation and system analysts, advisors and vendors or software developers as well as work implementing and modifying standard software for business administration applications (for example SAP).

Moreover, bachelor degree holders can work in hybrid occupations as so-called hybrid experts, i.e. individuals who are familiar with business problems and are capable of designing IT solutions. These individuals are often employed in a coordinating function between the operating department and the IT department. Project managers, project coordinators and system analysts are some examples of specific professions. Fields that graduates can work in include either those (1) within the data processing (DP) department (for example, system analysis, user consulting, DP control) or (2) outside the DP department in business-oriented operational departments with distinct DP references, such as organisation.

Get to know the different professional fields of our graduates in the alumni portraits .",m,"['General', 'information', 'What', 'is', 'it', 'all', 'about', 'As', 'an', 'interdisciplinary', 'subject', 'the', 'business', 'information', 'systems', 'degree', 'programme', 'is', 'composed', 'of', 'economic', 'content', 'primarily', 'business', 'administration', 'informatics', 'content', 'and', 'additional', 'business', 'informatics', 'content', 'Information', 'management', 'system', 'development', 'and', 'system', 'selection', 'as', 'well', 'as', 'business', 'application', 'systems', 'for', 'example', 'are', 'fundamental', 'subfields', 'of', 'the', 'business', 'information', 'systems', 'degree', 'programme', 'In', 'your', 'studies', 'you', 'will', 'deal', 'with', 'topics', 'such', 'as', 'the', 'design', 'of', 'application', 'systems', 'mobile', 'applications', 'data', 'management', 'and', 'machine', 'learning', 'The', 'generous', 'elective', 'area', 'gives', 'you', 'the', 'opportunity', 'to', 'get', 'to', 'know', 'many', 'different', 'subject', 'areas', 'in', 'order', 'to', 'discover', 'new', 'interests', 'also', 'through', 'modules', 'outside', 'of', 'business', 'informatics', 'and', 'economics', 'You', 'must', 'be', 'able', 'to', 'apply', 'your', 'knowledge', 'in', 'reality', 'Therefore', 'all', 'modules', 'are', 'designed', 'to', 'establish', 'a', 'link', 'to', 'practice', 'and', 'to', 'smooth', 'your', 'transition', 'into', 'professional', 'life', 'in', 'the', 'fast', 'moving', 'IT', 'industries', 'through', 'up', 'to', 'date', 'content', 'In', 'the', 'project', 'seminar', 'on', 'system', 'development', 'you', 'will', 'design', 'and', 'accompany', 'also', 'in', 'cooperation', 'with', 'practical', 'partners', 'from', 'the', 'business', 'world', 'the', 'complete', 'development', 'of', 'a', 'software', 'solution', 'In', 'hardly', 'any', 'other', 'industry', 'does', 'the', 'relevant', 'knowledge', 'change', 'as', 'quickly', 'as', 'in', 'IT', 'We', 'prepare', 'you', 'optimally', 'for', 'this', 'dynamic', 'professional', 'field', 'On', 'the', 'one', 'hand', 'we', 'teach', 'you', 'practical', 'and', 'cutting', 'edge', 'content', 'and', 'on', 'the', 'other', 'hand', 'timeless', 'methods', 'that', 'will', 'help', 'you', 'to', 'familiarise', 'yourself', 'with', 'new', 'tasks', 'throughout', 'your', 'entire', 'professional', 'life', 'The', 'programme', 'is', 'completely', 'modularised', 'credits', 'are', 'acquired', 'during', 'studies', 'The', 'programme', 'is', 'successfully', 'completed', 'when', 'credits', 'have', 'been', 'earned', 'Personal', 'skills', 'For', 'a', 'qualified', 'bachelor', 'programme', 'in', 'the', 'field', 'of', 'economics', 'students', 'must', 'especially', 'have', 'sound', 'knowledge', 'in', 'the', 'English', 'language', 'international', 'students', 'also', 'must', 'have', 'good', 'German', 'language', 'skills', 'mathematics', 'as', 'well', 'as', 'information', 'and', 'communications', 'systems', 'ICS', 'Students', 'whose', 'knowledge', 'of', 'German', 'mathematics', 'or', 'ICS', 'is', 'poor', 'are', 'strongly', 'suggested', 'to', 'improve', 'in', 'these', 'areas', 'before', 'beginning', 'with', 'the', 'programme', 'The', 'Faculty', 'of', 'Business', 'and', 'Economics', 'also', 'offers', 'a', 'precourse', 'in', 'Mathematics', 'for', 'new', 'students', 'to', 'prepare', 'them', 'for', 'the', 'following', 'modules', 'in', 'Mathematics', 'every', 'winter', 'and', 'summer', 'semester', 'Selection', 'procedure', 'and', 'admission', 'criteria', 'Admission', 'to', 'the', 'Bachelor', 'degree', 'programme', 'in', 'Business', 'Information', 'Systems', 'is', 'restricted', 'in', 'the', 'first', 'subject', 'related', 'semester', 'while', 'the', 'higher', 'subject', 'related', 'semesters', 'are', 'not', 'subject', 'to', 'admission', 'restrictions', 'Students', 'can', 'apply', 'and', 'be', 'enrolled', 'in', 'both', 'the', 'summer', 'and', 'winter', 'semesters', 'What', 'we', 'expect', 'from', 'you', 'Motivation', 'and', 'a', 'will', 'to', 'achieve', 'Interest', 'in', 'entrepreneurial', 'or', 'macroeconomic', 'issues', 'Analytical', 'thinking', 'faculties', 'as', 'well', 'as', 'an', 'interest', 'in', 'and', 'ability', 'to', 'deal', 'with', 'mathematical', 'methods', 'of', 'presentation', 'Good', 'proficiency', 'in', 'German', 'a', 'good', 'or', 'at', 'least', 'working', 'knowledge', 'of', 'the', 'English', 'language', 'Career', 'perspectives', 'As', 'a', 'graduate', 'with', 'a', 'bachelor', 'degree', 'you', 'will', 'have', 'career', 'opportunities', 'in', 'a', 'multitude', 'of', 'professions', 'The', 'labour', 'market', 'continues', 'to', 'be', 'characterised', 'by', 'a', 'strong', 'demand', 'for', 'highly', 'qualified', 'information', 'technology', 'IT', 'specialists', 'Core', 'occupations', 'for', 'graduates', 'of', 'the', 'Bachelor', 'programme', 'in', 'Business', 'Information', 'Systems', 'include', 'jobs', 'as', 'computer', 'specialists', 'and', 'system', 'analysts', 'Bachelor', 'degree', 'graduates', 'will', 'be', 'tasked', 'with', 'planning', 'documenting', 'and', 'rolling', 'out', 'hardware', 'and', 'software', 'and', 'gathering', 'data', 'on', 'the', 'impacts', 'on', 'organisational', 'forms', 'This', 'additionally', 'involves', 'support', 'in', 'solving', 'problems', 'and', 'the', 'modification', 'or', 'new', 'development', 'of', 'concepts', 'Concrete', 'jobs', 'for', 'graduates', 'with', 'a', 'bachelor', 'degree', 'include', 'jobs', 'as', 'specialists', 'at', 'computing', 'centres', 'and', 'user', 'services', 'organisation', 'and', 'system', 'analysts', 'advisors', 'and', 'vendors', 'or', 'software', 'developers', 'as', 'well', 'as', 'work', 'implementing', 'and', 'modifying', 'standard', 'software', 'for', 'business', 'administration', 'applications', 'for', 'example', 'SAP', 'Moreover', 'bachelor', 'degree', 'holders', 'can', 'work', 'in', 'hybrid', 'occupations', 'as', 'so', 'called', 'hybrid', 'experts', 'individuals', 'who', 'are', 'familiar', 'with', 'business', 'problems', 'and', 'are', 'capable', 'of', 'designing', 'IT', 'solutions', 'These', 'individuals', 'are', 'often', 'employed', 'in', 'a', 'coordinating', 'function', 'between', 'the', 'operating', 'department', 'and', 'the', 'IT', 'department', 'Project', 'managers', 'project', 'coordinators', 'and', 'system', 'analysts', 'are', 'some', 'examples', 'of', 'specific', 'professions', 'Fields', 'that', 'graduates', 'can', 'work', 'in', 'include', 'either', 'those', 'within', 'the', 'data', 'processing', 'DP', 'department', 'for', 'example', 'system', 'analysis', 'user', 'consulting', 'DP', 'control', 'or', 'outside', 'the', 'DP', 'department', 'in', 'business', 'oriented', 'operational', 'departments', 'with', 'distinct', 'DP', 'references', 'such', 'as', 'organisation', 'Get', 'to', 'know', 'the', 'different', 'professional', 'fields', 'of', 'our', 'graduates', 'in', 'the', 'alumni', 'portraits']",2.6014485981308413
8,108,b-physics,"Programme overview

Our Bachelor degree program aims to provide students with a broad education in physics and neighboring disciplines. The curriculum has a strong emphasis in math and physics. The career opportunities for physics graduates are as diverse as the field itself. They include: research and development, management or administration in industrial laboratories or technical sales, electronic design or laser instrument research. Physics graduates may also enter a wide variety of graduate programs; for example Condensed Matter & Materials Sciences, Astro- and Particle Physics and Biophysics and Complex systems.

The classes of physics require a good basis of physics, mathematics, chemistry, and at a higher level English. This basis is the Abiturwissen of a basic physics course in German high school. Not all students take mathematics up to the end of school. We offer a preparatory course which is intended to bring all freshmen up to the same level. We highly recommend this class to students. It is currently only available in German.",m,"['Programme', 'overview', 'Our', 'Bachelor', 'degree', 'program', 'aims', 'to', 'provide', 'students', 'with', 'a', 'broad', 'education', 'in', 'physics', 'and', 'neighboring', 'disciplines', 'The', 'curriculum', 'has', 'a', 'strong', 'emphasis', 'in', 'math', 'and', 'physics', 'The', 'career', 'opportunities', 'for', 'physics', 'graduates', 'are', 'as', 'diverse', 'as', 'the', 'field', 'itself', 'They', 'include', 'research', 'and', 'development', 'management', 'or', 'administration', 'in', 'industrial', 'laboratories', 'or', 'technical', 'sales', 'electronic', 'design', 'or', 'laser', 'instrument', 'research', 'Physics', 'graduates', 'may', 'also', 'enter', 'a', 'wide', 'variety', 'of', 'graduate', 'programs', 'for', 'example', 'Condensed', 'Matter', 'Materials', 'Sciences', 'and', 'Particle', 'Physics', 'and', 'Biophysics', 'and', 'Complex', 'systems', 'The', 'classes', 'of', 'physics', 'require', 'a', 'good', 'basis', 'of', 'physics', 'mathematics', 'chemistry', 'and', 'at', 'a', 'higher', 'level', 'English', 'This', 'basis', 'is', 'the', 'Abiturwissen', 'of', 'a', 'basic', 'physics', 'course', 'in', 'German', 'high', 'school', 'Not', 'all', 'students', 'take', 'mathematics', 'up', 'to', 'the', 'end', 'of', 'school', 'We', 'offer', 'a', 'preparatory', 'course', 'which', 'is', 'intended', 'to', 'bring', 'all', 'freshmen', 'up', 'to', 'the', 'same', 'level', 'We', 'highly', 'recommend', 'this', 'class', 'to', 'students', 'It', 'is', 'currently', 'only', 'available', 'in', 'German']",2.6322077922077924
9,109,m-appl-data-science,"Program Description
Data science is the frontier of the modern competitive landscape, a field where expertise turns raw data into strategic power. In Göttingen, our master's programme is engineered for those who thrive on solving complex problems. It's not just about mastering the core disciplines of Mathematics, Computer Science, and Statistics; it's about wielding these skills like a craftsman to extract actionable insights across various domains. Our programme is tailored for those ready to lead in Computational Neuroscience, Bioinformatics, Medical Data Science, and Digital Humanities—with more innovative fields on the horizon.
Our commitment is to forge leaders in data science. This means not only deep-diving into the analytics and methodologies that drive the digital age but also ensuring you're equipped to manage and spearhead research projects with autonomy. We emphasize the critical skill of articulating your discoveries, grounding your work in ethical considerations, and understanding the broader implications of data-driven decision-making.
Through rigorous research orientation and hands-on internships, we connect you with industry frontrunners, preparing you to navigate and influence the technological challenges of our times. This programme is your gateway to becoming a pivotal player in any sector, ready to harness the power of data to forge new paths and drive innovation.
General Information
Göttingen is a hub where interdisciplinary prowess in Data Science meets practical application. Our programme is designed to arm you with the methodologies and insights to excel in dynamic fields, from Computational Neuroscience to Digital Humanities. Each track is a collaboration with leading departments and institutes, ensuring a rich, cross-disciplinary learning experience.
Occupational fields
In an era where Data Scientists are the new elite, our graduates are the architects of the future, crafting solutions in sectors as diverse as manufacturing, finance, healthcare, and academia. With a mastery of data science, your career possibilities are limitless, opening doors to leadership roles in innovation-driven companies, groundbreaking research institutions, and beyond. For those with a vision to reshape industries, our programme is your launchpad to achieving a doctorate and leading the charge in data-driven transformation.",m,"['Program', 'Description', 'Data', 'science', 'is', 'the', 'frontier', 'of', 'the', 'modern', 'competitive', 'landscape', 'a', 'field', 'where', 'expertise', 'turns', 'raw', 'data', 'into', 'strategic', 'power', 'In', 'Göttingen', 'our', 'master', 'programme', 'is', 'engineered', 'for', 'those', 'who', 'thrive', 'on', 'solving', 'complex', 'problems', 'It', 'not', 'just', 'about', 'mastering', 'the', 'core', 'disciplines', 'of', 'Mathematics', 'Computer', 'Science', 'and', 'Statistics', 'it', 'about', 'wielding', 'these', 'skills', 'like', 'a', 'craftsman', 'to', 'extract', 'actionable', 'insights', 'across', 'various', 'domains', 'Our', 'programme', 'is', 'tailored', 'for', 'those', 'ready', 'to', 'lead', 'in', 'Computational', 'Neuroscience', 'Bioinformatics', 'Medical', 'Data', 'Science', 'and', 'Digital', 'Humanities', 'with', 'more', 'innovative', 'fields', 'on', 'the', 'horizon', 'Our', 'commitment', 'is', 'to', 'forge', 'leaders', 'in', 'data', 'science', 'This', 'means', 'not', 'only', 'deep', 'diving', 'into', 'the', 'analytics', 'and', 'methodologies', 'that', 'drive', 'the', 'digital', 'age', 'but', 'also', 'ensuring', 'you', 'equipped', 'to', 'manage', 'and', 'spearhead', 'research', 'projects', 'with', 'autonomy', 'We', 'emphasize', 'the', 'critical', 'skill', 'of', 'articulating', 'your', 'discoveries', 'grounding', 'your', 'work', 'in', 'ethical', 'considerations', 'and', 'understanding', 'the', 'broader', 'implications', 'of', 'data', 'driven', 'decision', 'making', 'Through', 'rigorous', 'research', 'orientation', 'and', 'hands', 'on', 'internships', 'we', 'connect', 'you', 'with', 'industry', 'frontrunners', 'preparing', 'you', 'to', 'navigate', 'and', 'influence', 'the', 'technological', 'challenges', 'of', 'our', 'times', 'This', 'programme', 'is', 'your', 'gateway', 'to', 'becoming', 'a', 'pivotal', 'player', 'in', 'any', 'sector', 'ready', 'to', 'harness', 'the', 'power', 'of', 'data', 'to', 'forge', 'new', 'paths', 'and', 'drive', 'innovation', 'General', 'Information', 'Göttingen', 'is', 'a', 'hub', 'where', 'interdisciplinary', 'prowess', 'in', 'Data', 'Science', 'meets', 'practical', 'application', 'Our', 'programme', 'is', 'designed', 'to', 'arm', 'you', 'with', 'the', 'methodologies', 'and', 'insights', 'to', 'excel', 'in', 'dynamic', 'fields', 'from', 'Computational', 'Neuroscience', 'to', 'Digital', 'Humanities', 'Each', 'track', 'is', 'a', 'collaboration', 'with', 'leading', 'departments', 'and', 'institutes', 'ensuring', 'a', 'rich', 'cross', 'disciplinary', 'learning', 'experience', 'Occupational', 'fields', 'In', 'an', 'era', 'where', 'Data', 'Scientists', 'are', 'the', 'new', 'elite', 'our', 'graduates', 'are', 'the', 'architects', 'of', 'the', 'future', 'crafting', 'solutions', 'in', 'sectors', 'as', 'diverse', 'as', 'manufacturing', 'finance', 'healthcare', 'and', 'academia', 'With', 'a', 'mastery', 'of', 'data', 'science', 'your', 'career', 'possibilities', 'are', 'limitless', 'opening', 'doors', 'to', 'leadership', 'roles', 'in', 'innovation', 'driven', 'companies', 'groundbreaking', 'research', 'institutions', 'and', 'beyond', 'For', 'those', 'with', 'a', 'vision', 'to', 'reshape', 'industries', 'our', 'programme', 'is', 'your', 'launchpad', 'to', 'achieving', 'a', 'doctorate', 'and', 'leading', 'the', 'charge', 'in', 'data', 'driven', 'transformation']",2.6087313432835826
10,110,b-philosophy,"Subject description

Philosophy deals with the fundamental question of theoretical world interpretation and practical formation of life. It examines aspects that can be clarified through methodical contemplation. In order to do so, the ability to logically analyse abstract theoretical problems as well as to argument logically correctly must be acquired. The course of study comprises systematic parts (theoretical and practical philosophy) as well as historical (history of philosophy). Disciplines belonging to theoretical philosophy are epistemology, scientific theory, philosophy of language, philosophy of mind as well as aesthetics. Practical parts include, among others, ethics, political philosophy, law and social philosophy. The historical part is studied using selected texts of classic philosophic authors and based on philosophical-historical epochs.

Studies in the two-subject bachelor's programme aim to make the students appropriately comprehend problems and conceptions of philosophy, deal with them scientifically and to communicate their basic principles in a manner understandable to all. The graduates should especially have the skills to appropriately use the scientific aids of the study of philosophy, to understand and apply methods of philosophical thought and argumentation, to understand and classify philosophical texts in their historical interpretation and systematic connection, deal with philosophical problems of intermediate difficulty in written and oral form with precise terminology, and to weigh arguments against each other in an appropriate manner",n,"['Subject', 'description', 'Philosophy', 'deals', 'with', 'the', 'fundamental', 'question', 'of', 'theoretical', 'world', 'interpretation', 'and', 'practical', 'formation', 'of', 'life', 'It', 'examines', 'aspects', 'that', 'can', 'be', 'clarified', 'through', 'methodical', 'contemplation', 'In', 'order', 'to', 'do', 'so', 'the', 'ability', 'to', 'logically', 'analyse', 'abstract', 'theoretical', 'problems', 'as', 'well', 'as', 'to', 'argument', 'logically', 'correctly', 'must', 'be', 'acquired', 'The', 'course', 'of', 'study', 'comprises', 'systematic', 'parts', 'theoretical', 'and', 'practical', 'philosophy', 'as', 'well', 'as', 'historical', 'history', 'of', 'philosophy', 'Disciplines', 'belonging', 'to', 'theoretical', 'philosophy', 'are', 'epistemology', 'scientific', 'theory', 'philosophy', 'of', 'language', 'philosophy', 'of', 'mind', 'as', 'well', 'as', 'aesthetics', 'Practical', 'parts', 'include', 'among', 'others', 'ethics', 'political', 'philosophy', 'law', 'and', 'social', 'philosophy', 'The', 'historical', 'part', 'is', 'studied', 'using', 'selected', 'texts', 'of', 'classic', 'philosophic', 'authors', 'and', 'based', 'on', 'philosophical', 'historical', 'epochs', 'Studies', 'in', 'the', 'two', 'subject', 'bachelor', 'programme', 'aim', 'to', 'make', 'the', 'students', 'appropriately', 'comprehend', 'problems', 'and', 'conceptions', 'of', 'philosophy', 'deal', 'with', 'them', 'scientifically', 'and', 'to', 'communicate', 'their', 'basic', 'principles', 'in', 'a', 'manner', 'understandable', 'to', 'all', 'The', 'graduates', 'should', 'especially', 'have', 'the', 'skills', 'to', 'appropriately', 'use', 'the', 'scientific', 'aids', 'of', 'the', 'study', 'of', 'philosophy', 'to', 'understand', 'and', 'apply', 'methods', 'of', 'philosophical', 'thought', 'and', 'argumentation', 'to', 'understand', 'and', 'classify', 'philosophical', 'texts', 'in', 'their', 'historical', 'interpretation', 'and', 'systematic', 'connection', 'deal', 'with', 'philosophical', 'problems', 'of', 'intermediate', 'difficulty', 'in', 'written', 'and', 'oral', 'form', 'with', 'precise', 'terminology', 'and', 'to', 'weigh', 'arguments', 'against', 'each', 'other', 'in', 'an', 'appropriate', 'manner']",2.3705825242718443
